{"baseline":"c8b98a29508b5eb7725c75a7e2a41dfa94c1feba","auditDate":"2026-07-26","section":"scripts/","gates":["security","data-integrity","performance"],"auditedFiles":["scripts/doc-git-times-parity.test.mjs","scripts/doc-hygiene-artifact-path-parity.test.mjs"],"verdicts":[{"file":"scripts/doc-git-times-parity.test.mjs","gates":[{"gate":"security","status":"n/a","reason":"Parity assertions over imported constants do not implement authentication, filesystem writes, command execution, web boundaries, secret handling, or deployment controls."},{"gate":"data-integrity","status":"clean","reason":"The tests reproducibly enforce manifest location, schema version, capacity, and pathspec parity across the producer and consumers; no arithmetic, recommendation claim, stale signal, or fix snippet is present."},{"gate":"performance","status":"n/a","reason":"This is a small CI parity test with no runtime hot path, rendering, ingest loop, bundle surface, or production probe obligation."}]},{"file":"scripts/doc-hygiene-artifact-path-parity.test.mjs","gates":[{"gate":"security","status":"clean","reason":"Inspected temporary filesystem writes/removal, artifact-key traversal rejection, fixed-argument compose spawning, environment handling, and the read-only CLAUDE_DIR mount assertion; no exploitable path escape, injection, secret egress, or unsafe cleanup was found."},{"gate":"data-integrity","status":"clean","reason":"The tests reproducibly cover malformed and absent artifacts, root identity, canonical encoding, commit freshness, cross-namespace keys, and runtime/host commit mismatch; the fixture contains no unsupported recommendation claim or arithmetic defect."},{"gate":"performance","status":"n/a","reason":"The file is test-only and does not add a production hot path, client bundle surface, request-time recomputation, or ingest/assembly workload."}]}],"findings":[]}