{"baseline":"c8b98a29508b5eb7725c75a7e2a41dfa94c1feba","auditDate":"2026-07-26","section":"docs/","gates":["security","data-integrity","performance"],"auditedFiles":["docs/reviews/prototype/screenshot-before-flat.png"],"verdicts":[{"file":"docs/reviews/prototype/screenshot-before-flat.png","gates":[{"gate":"security","status":"clean","reason":"Inspected the 1200×900 RGB PNG and its rendered contents; it is an inert prototype screenshot with no visible credentials, secrets, executable content, or sensitive user data."},{"gate":"data-integrity","status":"n/a","reason":"This prototype screenshot is not detector, parser, calculation, recommendation, provenance, or validated-fix-snippet code."},{"gate":"performance","status":"n/a","reason":"This 81,277-byte documentation screenshot is not hot-path code, an ingest/assembly path, or a shipped runtime surface."}]}],"findings":[]}