{"baseline":"c8b98a29508b5eb7725c75a7e2a41dfa94c1feba","auditDate":"2026-07-26","section":"src/lib/detectors","gates":["security","data-integrity","performance"],"auditedFiles":["src/lib/detectors/workflow/value-of-agent-handoff.test.ts"],"verdicts":[{"file":"src/lib/detectors/workflow/value-of-agent-handoff.test.ts","gates":[{"gate":"security","status":"clean","reason":"Security-relevant command and path fixtures are inert test data; the file does not execute commands, write files, handle credentials, or introduce client/server, RBAC, TLS, or supply-chain behavior. Its adversarial cases cover traversal aliases, paths outside project roots, ambiguous shell constructs, and bounded parsing without unsafe execution."},{"gate":"data-integrity","status":"clean","reason":"The detector tests explicitly exercise structured provenance, freshness/as-of demotion, unavailable and ambiguous evidence, project attribution, copy-paste fix validation, and honest-null behavior. Re-derived examples are consistent: 10+15+20=45 minutes with median 15, while sub-floor, zero, stale, future, and unparseable observations are handled without unsupported published savings."},{"gate":"performance","status":"n/a","reason":"This is test-only code and does not run on the production hot path, ship a runtime surface, add bundle weight, or introduce per-request recomputation or ingest latency."}]}],"findings":[]}