{"baseline":"c8b98a29508b5eb7725c75a7e2a41dfa94c1feba","auditDate":"2026-07-26","section":"fixtures/","gates":["security","data-integrity","performance"],"auditedFiles":["fixtures/proof/repo-map-context-waste/pairs/high-centrality-extend-status/tree/src/status.mjs","fixtures/proof/repo-map-context-waste/pairs/high-centrality-extend-status/tree/src/summary.mjs","fixtures/proof/repo-map-context-waste/pairs/high-centrality-extend-status/tree/src/valid.mjs","fixtures/proof/repo-map-context-waste/pairs/high-centrality-extend-status/tree/test.mjs","fixtures/proof/repo-map-context-waste/pairs/high-centrality-rename-diff/tree/src/all.mjs","fixtures/proof/repo-map-context-waste/pairs/high-centrality-rename-diff/tree/src/attempt.mjs","fixtures/proof/repo-map-context-waste/pairs/high-centrality-rename-diff/tree/src/chain.mjs","fixtures/proof/repo-map-context-waste/pairs/high-centrality-rename-diff/tree/src/divide.mjs","fixtures/proof/repo-map-context-waste/pairs/high-centrality-rename-diff/tree/src/first.mjs","fixtures/proof/repo-map-context-waste/pairs/high-centrality-rename-diff/tree/src/guard.mjs","fixtures/proof/repo-map-context-waste/pairs/high-centrality-rename-diff/tree/src/lookup.mjs","fixtures/proof/repo-map-context-waste/pairs/high-centrality-rename-diff/tree/src/mapOk.mjs","fixtures/proof/repo-map-context-waste/pairs/high-centrality-rename-diff/tree/src/result.mjs","fixtures/proof/repo-map-context-waste/pairs/high-centrality-rename-diff/tree/test.mjs"],"verdicts":[{"file":"fixtures/proof/repo-map-context-waste/pairs/high-centrality-extend-status/tree/src/status.mjs","gates":[{"gate":"security","status":"n/a","reason":"Static status registry and pure predicates; no security-sensitive boundary or operation."},{"gate":"data-integrity","status":"n/a","reason":"No detector, parser, recommendation claim, provenance, fix snippet, or arithmetic calculation."},{"gate":"performance","status":"n/a","reason":"Constant-size registry predicates in a frozen fixture, not a production hot path or new surface."}]},{"file":"fixtures/proof/repo-map-context-waste/pairs/high-centrality-extend-status/tree/src/summary.mjs","gates":[{"gate":"security","status":"n/a","reason":"Pure fixture summarizer stub with no security-sensitive input sink or boundary."},{"gate":"data-integrity","status":"clean","reason":"Count-calculation concern applies; the empty implementation is explicitly the frozen controlled task input whose pristine gate must fail, not a shipped calculation defect."},{"gate":"performance","status":"n/a","reason":"Frozen zero-dependency fixture task subject, not production ingest, rendering, request, or surface code."}]},{"file":"fixtures/proof/repo-map-context-waste/pairs/high-centrality-extend-status/tree/src/valid.mjs","gates":[{"gate":"security","status":"n/a","reason":"Pure status-membership fixture stub; it performs no authorization, I/O, rendering, or injection-sensitive operation."},{"gate":"data-integrity","status":"n/a","reason":"No detector, parser, recommendation claim, provenance, fix snippet, or arithmetic calculation."},{"gate":"performance","status":"n/a","reason":"Frozen fixture helper, not a production hot path or new monitored surface."}]},{"file":"fixtures/proof/repo-map-context-waste/pairs/high-centrality-extend-status/tree/test.mjs","gates":[{"gate":"security","status":"n/a","reason":"Local deterministic unit-test definitions with no security boundary, secret handling, network egress, or writable path."},{"gate":"data-integrity","status":"n/a","reason":"Objective fixture gate assertions, not detector/parser output, recommendation evidence, provenance, or validated fix content."},{"gate":"performance","status":"n/a","reason":"Small fixture unit tests are not shipped hot-path code and introduce no production surface."}]},{"file":"fixtures/proof/repo-map-context-waste/pairs/high-centrality-rename-diff/tree/src/all.mjs","gates":[{"gate":"security","status":"n/a","reason":"Pure Result-combinator fixture stub with no security-sensitive boundary or sink."},{"gate":"data-integrity","status":"n/a","reason":"No detector, parser, recommendation claim, provenance, validated fix, or arithmetic calculation."},{"gate":"performance","status":"n/a","reason":"Frozen fixture task subject, not production hot-path or surface code."}]},{"file":"fixtures/proof/repo-map-context-waste/pairs/high-centrality-rename-diff/tree/src/attempt.mjs","gates":[{"gate":"security","status":"n/a","reason":"Invokes an explicitly supplied in-process callback only; no shell, SQL, filesystem, web, auth, or egress boundary."},{"gate":"data-integrity","status":"n/a","reason":"No detector, parser, recommendation claim, provenance, validated fix, or arithmetic calculation."},{"gate":"performance","status":"n/a","reason":"Frozen fixture Result helper stub, not production request, ingest, render, or surface code."}]},{"file":"fixtures/proof/repo-map-context-waste/pairs/high-centrality-rename-diff/tree/src/chain.mjs","gates":[{"gate":"security","status":"n/a","reason":"Pure in-process Result-combinator fixture stub with no security-sensitive sink or boundary."},{"gate":"data-integrity","status":"n/a","reason":"No detector, parser, recommendation claim, provenance, validated fix, or arithmetic calculation."},{"gate":"performance","status":"n/a","reason":"Frozen fixture helper, not a production hot path or new surface."}]},{"file":"fixtures/proof/repo-map-context-waste/pairs/high-centrality-rename-diff/tree/src/divide.mjs","gates":[{"gate":"security","status":"n/a","reason":"Pure numeric fixture stub with no security-sensitive input sink, I/O, or boundary."},{"gate":"data-integrity","status":"clean","reason":"Arithmetic concern applies; quotient and zero-divisor behavior are reproducibly specified by the fixture gate, while the throwing stub is explicitly frozen controlled task input whose pristine gate must fail."},{"gate":"performance","status":"n/a","reason":"Constant-work fixture calculation, not production hot-path or surface code."}]},{"file":"fixtures/proof/repo-map-context-waste/pairs/high-centrality-rename-diff/tree/src/first.mjs","gates":[{"gate":"security","status":"n/a","reason":"Pure Result-selection fixture stub with no security-sensitive boundary or operation."},{"gate":"data-integrity","status":"n/a","reason":"No detector, parser, recommendation claim, provenance, validated fix, or arithmetic calculation."},{"gate":"performance","status":"n/a","reason":"Frozen fixture helper, not production hot-path or new-surface code."}]},{"file":"fixtures/proof/repo-map-context-waste/pairs/high-centrality-rename-diff/tree/src/guard.mjs","gates":[{"gate":"security","status":"n/a","reason":"Pure numeric guard fixture stub with no authorization, I/O, rendering, injection, or secret concern."},{"gate":"data-integrity","status":"n/a","reason":"A simple domain predicate, not detector/parser calculation output, recommendation evidence, provenance, or validated fix content."},{"gate":"performance","status":"n/a","reason":"Constant-work fixture predicate, not a production hot path or new surface."}]},{"file":"fixtures/proof/repo-map-context-waste/pairs/high-centrality-rename-diff/tree/src/lookup.mjs","gates":[{"gate":"security","status":"n/a","reason":"In-memory object lookup fixture stub with no filesystem path, database, command, web, auth, or egress boundary."},{"gate":"data-integrity","status":"n/a","reason":"No detector, parser, recommendation claim, provenance, validated fix, or arithmetic calculation."},{"gate":"performance","status":"n/a","reason":"Single in-memory lookup in a frozen fixture, not production hot-path or surface code."}]},{"file":"fixtures/proof/repo-map-context-waste/pairs/high-centrality-rename-diff/tree/src/mapOk.mjs","gates":[{"gate":"security","status":"n/a","reason":"Pure in-process Result mapping fixture stub with no security-sensitive sink or boundary."},{"gate":"data-integrity","status":"n/a","reason":"No detector, parser, recommendation claim, provenance, validated fix, or arithmetic calculation."},{"gate":"performance","status":"n/a","reason":"Frozen fixture helper, not production request, ingest, render, or surface code."}]},{"file":"fixtures/proof/repo-map-context-waste/pairs/high-centrality-rename-diff/tree/src/result.mjs","gates":[{"gate":"security","status":"n/a","reason":"Pure Result constructors and predicate; no security-sensitive boundary, I/O, or sink."},{"gate":"data-integrity","status":"n/a","reason":"No detector, parser, recommendation claim, provenance, validated fix, or arithmetic calculation."},{"gate":"performance","status":"n/a","reason":"Constant-work fixture value helpers, not production hot-path or new-surface code."}]},{"file":"fixtures/proof/repo-map-context-waste/pairs/high-centrality-rename-diff/tree/test.mjs","gates":[{"gate":"security","status":"n/a","reason":"Local deterministic unit-test definitions with no security boundary, secret handling, network egress, or writable path."},{"gate":"data-integrity","status":"n/a","reason":"Objective fixture assertions, not detector/parser output, recommendation evidence, structured provenance, or validated fix content."},{"gate":"performance","status":"n/a","reason":"Small fixture unit tests are not shipped hot-path code and introduce no production surface."}]}],"findings":[]}