{"baseline":"c8b98a29508b5eb7725c75a7e2a41dfa94c1feba","auditDate":"2026-07-26","section":"src/lib (non-detectors)","gates":["security","data-integrity","performance"],"auditedFiles":["src/lib/route-filtering.ts","src/lib/routing-core.ts","src/lib/routing.test.ts","src/lib/routing.ts","src/lib/sample-adoption.test.ts","src/lib/sample-artifacts.test.ts","src/lib/sample-artifacts.ts","src/lib/sample-corpus.test.ts","src/lib/sample-data.ts","src/lib/sample-doc-neighborhood.test.ts"],"verdicts":[{"file":"src/lib/route-filtering.ts","gates":[{"gate":"security","status":"n/a","reason":"Pure in-memory filtering; no auth, filesystem writes, egress, DOM sink, command execution, or secret handling."},{"gate":"data-integrity","status":"clean","reason":"Checked project, date, tool, and file matching, including finite numeric timestamps and per-call/session scoping; no recommendation claims or fix snippets are produced."},{"gate":"performance","status":"finding","reason":"Project-filtered tool and error rows repeatedly linearly scan the entire sessions array, creating O(rows × sessions) interactive filtering work."}]},{"file":"src/lib/routing-core.ts","gates":[{"gate":"security","status":"n/a","reason":"React-free constants and timestamp-range arithmetic have no security-sensitive boundary or side effect."},{"gate":"data-integrity","status":"clean","reason":"Re-derived 24-hour, 7-day, and 30-day millisecond spans and checked finite-clock fallback and all-time bounds."},{"gate":"performance","status":"clean","reason":"Range conversion is constant-time with no allocation or recomputation hotspot beyond one result object."}]},{"file":"src/lib/routing.test.ts","gates":[{"gate":"security","status":"n/a","reason":"Test-only code; fixtures do not exercise credentials, privileged boundaries, filesystem writes, or executable commands."},{"gate":"data-integrity","status":"clean","reason":"Tests pin route normalization, serialization round trips, evidence filters, and exact time-window arithmetic."},{"gate":"performance","status":"n/a","reason":"Test-only assertions are not a shipped hot path or performance surface."}]},{"file":"src/lib/routing.ts","gates":[{"gate":"security","status":"clean","reason":"Checked untrusted hash parsing, URLSearchParams encoding, view allowlisting, project allowlisting support, and CSS escaping before selector construction; no executable HTML or command sink is present."},{"gate":"data-integrity","status":"clean","reason":"Checked canonical route parsing/serialization, default normalization, redirect handling, filter equality, and hash/state synchronization."},{"gate":"performance","status":"clean","reason":"Routing uses bounded key iteration, one stable hashchange listener with cleanup, and guarded hash writes; no N× request or render computation was found."}]},{"file":"src/lib/sample-adoption.test.ts","gates":[{"gate":"security","status":"n/a","reason":"Test-only synthetic receipt fixtures do not cross an auth, filesystem, network, or client injection boundary."},{"gate":"data-integrity","status":"clean","reason":"Tests verify deterministic canonical receipts, sanitizer preservation, ordered lifecycle evidence, live-config attribution, and exact adoption arithmetic."},{"gate":"performance","status":"n/a","reason":"Test-only lifecycle assertions are not shipped hot-path code."}]},{"file":"src/lib/sample-artifacts.test.ts","gates":[{"gate":"security","status":"n/a","reason":"Test-only synthetic fixtures do not handle real secrets, authorization, filesystem writes, or network egress."},{"gate":"data-integrity","status":"clean","reason":"Tests exercise real recommendation assembly and validate seeded evidence, counts, clocks, staleness behavior, report-card joins, and recommendation outputs."},{"gate":"performance","status":"n/a","reason":"Test-only fixture assembly is not a production hot path or newly shipped runtime surface."}]},{"file":"src/lib/sample-artifacts.ts","gates":[{"gate":"security","status":"clean","reason":"Checked the SPA/server boundary and synthetic live-config, MCP-auth, paths, and model-eval fixtures; they contain no real credentials, ~/.claude reads, API egress, or executable secret material."},{"gate":"data-integrity","status":"clean","reason":"Re-derived percentage, activity, burst-rate, rework-score, date, and token-waste literals and checked that recommendation-facing fixtures carry deterministic structured evidence through real ingest functions."},{"gate":"performance","status":"clean","reason":"Demo generators are bounded by small literals or caller-provided session IDs, and heavy parser dependencies are not introduced for repo-map generation."}]},{"file":"src/lib/sample-corpus.test.ts","gates":[{"gate":"security","status":"n/a","reason":"Test-only synthetic corpus checks do not perform privileged writes, authentication, egress, or command execution."},{"gate":"data-integrity","status":"clean","reason":"Tests validate parser outputs, provenance-bearing evidence, recommendation derivations, deterministic eval ingestion, bounded task spans, and independently computed mean/correlation arithmetic."},{"gate":"performance","status":"n/a","reason":"Comprehensive test-suite parsing is not shipped runtime code and defines no new production surface."}]},{"file":"src/lib/sample-data.ts","gates":[{"gate":"security","status":"clean","reason":"Checked that the SPA performs only a same-base static asset fetch and passes bytes through the existing upload unzip boundary; it does not read ~/.claude, send credentials, or construct executable content."},{"gate":"data-integrity","status":"clean","reason":"The loader preserves history/session channel separation, excludes history from session files, derives IDs deterministically, and fails closed to null on malformed data."},{"gate":"performance","status":"clean","reason":"The bundled asset is fetched and inflated once, then partitioned with linear passes; no repeated per-render/request computation appears in this module."}]},{"file":"src/lib/sample-doc-neighborhood.test.ts","gates":[{"gate":"security","status":"n/a","reason":"Test-only graph assertions do not execute document content or cross a security-sensitive boundary."},{"gate":"data-integrity","status":"clean","reason":"Tests verify stale-signal demotion, contradiction and dangling-link evidence, supersession behavior, and exact induced graph relationships."},{"gate":"performance","status":"n/a","reason":"Test-only graph assertions are not a shipped hot path or performance surface."}]}],"findings":[{"lens":"performance","severity":"medium","title":"Project route filtering performs quadratic session lookups","files":["src/lib/route-filtering.ts:28","src/lib/route-filtering.ts:46","src/lib/route-filtering.ts:98"],"where":"src/lib/route-filtering.ts:28, src/lib/route-filtering.ts:46, and src/lib/route-filtering.ts:98","what":"sessionProject() uses Array.find across all sessions. Both project-filtered tool rows and project-filtered API-error rows invoke it once per row, so interactive filtering scales as O(rows × sessions). Large history datasets can therefore stall route-filtered views even though session-to-project attribution is static for the operation.","fix":"Build a Map from sessionId to project once per filtering call, or accept a pre-indexed lookup shared by both filters, then resolve each row in O(1). Preserve the current undefined-session behavior.","acceptance":"Add a large-fixture test or benchmark with thousands of sessions and rows that instruments session lookup work and proves it grows linearly with rows plus sessions, while existing project-filter results remain byte-for-byte equivalent.","priority":"Medium","verified":true,"verifyNote":"Adversarially re-read the cited baseline functions. The linear Array.find is still present at src/lib/route-filtering.ts:32 and is called inside both row iterations at lines 47 and 101; neither function builds or receives an index, so the O(rows × sessions) behavior is reproducible whenever a project filter is active."}]}