{"baseline":"c8b98a29508b5eb7725c75a7e2a41dfa94c1feba","auditDate":"2026-07-26","section":"probaitio-operator/","gates":["security","data-integrity","performance"],"auditedFiles":["probaitio-operator/.devcontainer/devcontainer.json","probaitio-operator/.devcontainer/post-install.sh","probaitio-operator/.dockerignore","probaitio-operator/.gitignore","probaitio-operator/.golangci.yml","probaitio-operator/Dockerfile","probaitio-operator/Dockerfile.dispatch"],"verdicts":[{"file":"probaitio-operator/.devcontainer/devcontainer.json","gates":[{"gate":"security","status":"finding","reason":"The development image and privileged Docker-in-Docker features use mutable tags rather than immutable digests."},{"gate":"data-integrity","status":"n/a","reason":"This container configuration defines no detector, parser, calculation, recommendation, or validated fix snippet."},{"gate":"performance","status":"n/a","reason":"This development-environment configuration is not application hot-path code or a shipped runtime surface."}]},{"file":"probaitio-operator/.devcontainer/post-install.sh","gates":[{"gate":"security","status":"finding","reason":"The script downloads and executes mutable release artifacts without checksum or signature verification."},{"gate":"data-integrity","status":"n/a","reason":"This installation script makes no detector, calculation, or recommendation claims."},{"gate":"performance","status":"n/a","reason":"This one-time development bootstrap script is not a runtime hot path."}]},{"file":"probaitio-operator/.dockerignore","gates":[{"gate":"security","status":"clean","reason":"Reviewed the build-context exclusion and paired selective Dockerfile COPY boundaries; no secret is embedded or copied by this file."},{"gate":"data-integrity","status":"n/a","reason":"This ignore configuration contains no detector, parser, calculation, or recommendation logic."},{"gate":"performance","status":"n/a","reason":"The file does not implement a runtime hot path, ingest path, or new observable surface."}]},{"file":"probaitio-operator/.gitignore","gates":[{"gate":"security","status":"clean","reason":"Reviewed the ignore rules for secret-bearing literals and unsafe path behavior; none is present, and ignore rules are not used as an authorization boundary."},{"gate":"data-integrity","status":"n/a","reason":"This repository housekeeping configuration contains no evidentiary or calculation logic."},{"gate":"performance","status":"n/a","reason":"Ignore rules do not execute on an application hot path or ship a runtime surface."}]},{"file":"probaitio-operator/.golangci.yml","gates":[{"gate":"security","status":"n/a","reason":"This local lint configuration defines no authentication, filesystem, network-egress, RBAC, container, TLS, or secret-handling behavior."},{"gate":"data-integrity","status":"n/a","reason":"The linter configuration contains no detector, parser, calculation, recommendation, or validated fix."},{"gate":"performance","status":"n/a","reason":"Lint selection and exclusions do not affect production hot-path execution."}]},{"file":"probaitio-operator/Dockerfile","gates":[{"gate":"security","status":"finding","reason":"Both build and runtime base images are selected by mutable tags without digest pinning."},{"gate":"data-integrity","status":"n/a","reason":"This image recipe contains no detector, parser, calculation, recommendation, or validated fix snippet."},{"gate":"performance","status":"n/a","reason":"This build recipe introduces no application hot-path computation or new runtime surface requiring a probe."}]},{"file":"probaitio-operator/Dockerfile.dispatch","gates":[{"gate":"security","status":"finding","reason":"The dispatch image installs an unversioned agent CLI and uses a mutable base tag, making production image contents non-reproducible and supply-chain mutable."},{"gate":"data-integrity","status":"n/a","reason":"This image recipe defines no detector, parser, arithmetic, recommendation claim, or validated fix snippet."},{"gate":"performance","status":"n/a","reason":"The file packages existing commands but does not implement a request, ingest, render, or calculation hot path."}]}],"findings":[{"lens":"security","severity":"medium","title":"Devcontainer dependencies are not immutably pinned","files":["probaitio-operator/.devcontainer/devcontainer.json:3","probaitio-operator/.devcontainer/devcontainer.json:5","probaitio-operator/.devcontainer/devcontainer.json:6"],"where":"probaitio-operator/.devcontainer/devcontainer.json:3,5-6","what":"The Go image and both devcontainer features are referenced only by mutable tags. Recreating the environment can therefore fetch different publisher-controlled content without a reviewed repository change; the Docker-in-Docker feature has especially broad execution capability.","fix":"Pin the image and both feature references to reviewed immutable OCI digests, with an explicit update process for refreshing those digests.","acceptance":"Resolve each configured OCI reference twice and verify the file contains an explicit immutable digest for all three dependencies; rebuilding after tag movement must still select the reviewed manifests.","priority":"Medium","verified":true,"verifyNote":"A separate baseline re-read confirmed that lines 3, 5, and 6 contain tag-only references and no digest, checksum, signature policy, or other immutable resolution control."},{"lens":"security","severity":"high","title":"Bootstrap script executes unverified mutable downloads as root","files":["probaitio-operator/.devcontainer/post-install.sh:4","probaitio-operator/.devcontainer/post-install.sh:8","probaitio-operator/.devcontainer/post-install.sh:12","probaitio-operator/.devcontainer/post-install.sh:13"],"where":"probaitio-operator/.devcontainer/post-install.sh:4-15","what":"The script fetches `latest` kind and kubebuilder executables plus a dynamically selected kubectl executable, marks them executable, and moves them into `/usr/local/bin` without checking a pinned version, checksum, or signature. A compromised redirect, release endpoint, or mutable upstream artifact becomes trusted executable code.","fix":"Pin explicit versions, download each artifact and its publisher-provided checksum or signature over HTTPS, verify it before chmod/move, and fail closed on any mismatch.","acceptance":"A static check confirms no `latest` or `stable.txt` selector remains and every downloaded executable is verified against a repository-pinned checksum or trusted signature before it is made executable or installed; a deliberately corrupted download makes the script exit nonzero.","priority":"High","verified":true,"verifyNote":"The adversarial re-read confirmed all three download-to-execution flows and found no verification command anywhere in the complete 23-line script."},{"lens":"security","severity":"medium","title":"Operator image base layers are selected by mutable tags","files":["probaitio-operator/Dockerfile:2","probaitio-operator/Dockerfile:33"],"where":"probaitio-operator/Dockerfile:2,33","what":"The builder uses `golang:1.25` and the runtime uses `gcr.io/distroless/static:nonroot`, both without immutable digests. Identical source builds can therefore consume different base contents, bypassing review and weakening provenance and rollback reproducibility.","fix":"Pin both `FROM` references to reviewed multi-architecture manifest digests while retaining human-readable version tags if desired.","acceptance":"Both `FROM` instructions include immutable `@sha256:` digests, and an image build records exactly those reviewed manifests for the intended platforms.","priority":"Medium","verified":true,"verifyNote":"A second full Dockerfile read at the specified baseline confirmed both `FROM` instructions are tag-only and that no later stage or configuration constrains their resolved digests."},{"lens":"security","severity":"high","title":"Dispatch golden image installs an unversioned agent runtime","files":["probaitio-operator/Dockerfile.dispatch:8","probaitio-operator/Dockerfile.dispatch:12"],"where":"probaitio-operator/Dockerfile.dispatch:8,12-14","what":"The credential-bearing dispatch image uses mutable `node:24` and runs `npm install -g @anthropic-ai/claude-code` without a version or integrity lock. A rebuild can silently install newly published base or CLI code, which then runs alongside runtime OAuth credentials and session data.","fix":"Pin the Node base to an OCI digest and install an exact reviewed Claude Code version with verified npm integrity or from a locked artifact; update both pins only through reviewed changes.","acceptance":"The `FROM` instruction contains an `@sha256:` digest, the npm install target contains an exact version with integrity verification, and two clean builds from the same source resolve identical base and CLI artifacts.","priority":"High","verified":true,"verifyNote":"The separate adversarial pass re-read the complete file and confirmed the base has no digest, the npm package has no version or integrity constraint, and the comment claiming tag-based pinning is not enforced by the Dockerfile."}]}