{"baseline":"c8b98a29508b5eb7725c75a7e2a41dfa94c1feba","auditDate":"2026-07-26","section":"fixtures/","gates":["security","data-integrity","performance"],"auditedFiles":["fixtures/experiment-runtime/v1/type-witness.ts"],"verdicts":[{"file":"fixtures/experiment-runtime/v1/type-witness.ts","gates":[{"gate":"security","status":"n/a","reason":"Generated static type-witness fixture; it performs no authentication, network egress, filesystem writes, command execution, rendering, or deployment configuration."},{"gate":"data-integrity","status":"n/a","reason":"This file is generated contract fixture data and compile-time type assertions, not detector, parser, recommendation, or calculation implementation code."},{"gate":"performance","status":"n/a","reason":"Static fixture/type-witness data is not hot-path runtime code and introduces no request, render, ingest, or shipped user-facing surface."}]}],"findings":[]}