{"baseline":"c8b98a29508b5eb7725c75a7e2a41dfa94c1feba","auditDate":"2026-07-26","section":"fixtures/","gates":["security","data-integrity","performance"],"auditedFiles":["fixtures/experiment-runtime/v1/valid/speed-background-first.codex.json","fixtures/experiment-runtime/v1/verdict-corrections.json","fixtures/local-analyze-eval/corpus.json","fixtures/model-eval-corpus/README.md","fixtures/model-eval-corpus/curated-corpus.json","fixtures/model-eval-corpus/oh-my-pi-NOTICE.md"],"verdicts":[{"file":"fixtures/experiment-runtime/v1/valid/speed-background-first.codex.json","gates":[{"gate":"security","status":"clean","reason":"Inspected the executable experiment fixture for paths, commands, credentials, egress settings, and privileged operations; none are present."},{"gate":"data-integrity","status":"clean","reason":"Re-derived the paired effect: 10000 ms minus 7500 ms equals the reported 2500 ms, with matching treatment, evidence, units, and sample counts."},{"gate":"performance","status":"n/a","reason":"Static contract fixture; it neither implements a hot path nor ships a runtime surface."}]},{"file":"fixtures/experiment-runtime/v1/verdict-corrections.json","gates":[{"gate":"security","status":"n/a","reason":"Static verdict-validation data contains no commands, paths, credentials, egress, web surface, or privilege configuration."},{"gate":"data-integrity","status":"clean","reason":"Inspected the valid correction and three deliberately invalid variants; each mutation matches its declared expected validation code, and the valid effect fields are internally consistent."},{"gate":"performance","status":"n/a","reason":"Static validation fixture does not implement ingest, rendering, request handling, or another performance-sensitive path."}]},{"file":"fixtures/local-analyze-eval/corpus.json","gates":[{"gate":"security","status":"clean","reason":"Offline mock-model corpus was checked for secrets, filesystem targets, executable commands, injection payloads, and uncontrolled egress; none are present."},{"gate":"data-integrity","status":"finding","reason":"Recommendation claims, including quantitative and present-tense assertions, lack artifact/field citations and structured provenance."},{"gate":"performance","status":"n/a","reason":"Small static evaluation corpus does not implement a hot path or introduce a production surface."}]},{"file":"fixtures/model-eval-corpus/README.md","gates":[{"gate":"security","status":"n/a","reason":"Narrative documentation is not executable configuration; its security descriptions do not themselves perform egress, filesystem access, or command execution."},{"gate":"data-integrity","status":"n/a","reason":"Narrative documentation is not detector, parser, or calculation code and does not define a recommendation claim."},{"gate":"performance","status":"n/a","reason":"Documentation does not implement or ship a runtime surface."}]},{"file":"fixtures/model-eval-corpus/curated-corpus.json","gates":[{"gate":"security","status":"clean","reason":"Inspected all four executable gate command strings and task prompts; they are fixed arguments without interpolation, secrets, traversal, shell metacharacter injection, or network egress."},{"gate":"data-integrity","status":"n/a","reason":"Task-manifest fixture defines deterministic scoring commands but contains no recommendation detector, parser, or derived calculation claim."},{"gate":"performance","status":"n/a","reason":"Four-entry static manifest does not implement a hot path or add a runtime surface."}]},{"file":"fixtures/model-eval-corpus/oh-my-pi-NOTICE.md","gates":[{"gate":"security","status":"n/a","reason":"License and provenance notice is non-executable and contains no security-sensitive configuration."},{"gate":"data-integrity","status":"n/a","reason":"Provenance and license documentation is not detector, parser, calculation code, or a recommendation claim."},{"gate":"performance","status":"n/a","reason":"Notice text has no runtime performance role."}]}],"findings":[{"lens":"data-integrity","severity":"medium","title":"Synthetic recommendations omit required claim provenance","files":["fixtures/local-analyze-eval/corpus.json:8"],"where":"fixtures/local-analyze-eval/corpus.json:8-24,35-50,62-70,80-96","what":"Every recommendation supplies title/detail/action claims but no artifact or parsed-field citation and no structured provenance. Quantitative claims such as “30K+ tokens” and “sub-5-minute idle gaps” are therefore not reproducible from the corpus, while several other claims assert observed behavior in present tense without an as-of date.","fix":"Add structured provenance to each recommendation, including observed facts tied to a named synthetic artifact/field, a separate inference, and an asOf date where time-derived; alternatively rewrite the records as explicitly non-claim placeholders that cannot be surfaced as recommendations.","acceptance":"A fixture validation check parses every recommendations[] entry and verifies that each factual claim has a source artifact and field, inference is separated from observations, and timestamp-derived claims include asOf; all nine entries pass.","priority":"Medium","verified":true,"verifyNote":"Adversarial second pass re-read fixtures/local-analyze-eval/corpus.json:8-24,35-50,62-70,80-96 and confirmed that none of the nine recommendation objects contains evidence or provenance fields. The repository auditability contract in docs/adding-a-recommendation.md requires artifact/field citations and structured provenance; the corpus note’s “Synthetic” label does not identify evidence for the specific quantitative claims."}]}