{"baseline":"c8b98a29508b5eb7725c75a7e2a41dfa94c1feba","auditDate":"2026-07-26","section":"docs/","gates":["security","data-integrity","performance"],"auditedFiles":["docs/reviews/per-view-synthesis.md","docs/reviews/prototype/README.md","docs/reviews/prototype/digest-led-nav.html","docs/reviews/prototype/outcome-first-nav.html"],"verdicts":[{"file":"docs/reviews/per-view-synthesis.md","gates":[{"gate":"security","status":"n/a","reason":"Narrative design synthesis; it contains no executable security boundary, credential flow, filesystem operation, or deployment configuration."},{"gate":"data-integrity","status":"n/a","reason":"Narrative review document, not detector/parser/calculation code and not a validated fix-snippet source."},{"gate":"performance","status":"n/a","reason":"Narrative design document with no runtime or production surface."}]},{"file":"docs/reviews/prototype/README.md","gates":[{"gate":"security","status":"n/a","reason":"Prototype documentation only; the run example binds a static server to localhost and defines no application security boundary."},{"gate":"data-integrity","status":"n/a","reason":"Usage documentation, not detector/parser/calculation code and not a validated recommendation fix."},{"gate":"performance","status":"n/a","reason":"Documentation for throwaway static prototypes, not a hot path or shipped surface."}]},{"file":"docs/reviews/prototype/digest-led-nav.html","gates":[{"gate":"security","status":"clean","reason":"Inspected the complete static HTML/JS prototype: it has no network egress, secrets, auth, filesystem writes, command execution, or external dependencies; HTML-template sinks receive only hard-coded in-file prototype data, while toast text uses textContent."},{"gate":"data-integrity","status":"n/a","reason":"Explicitly static mock data and interactions, not detector/parser/calculation code or a validated fix implementation."},{"gate":"performance","status":"n/a","reason":"Throwaway static prototype not wired into the application, so it is neither a production hot path nor a shipped surface requiring a probe or budget."}]},{"file":"docs/reviews/prototype/outcome-first-nav.html","gates":[{"gate":"security","status":"clean","reason":"Inspected the complete static HTML/JS prototype: it performs no network egress, authentication, filesystem writes, command execution, or dependency loading; dynamic markup is derived solely from hard-coded in-file arrays, and drill text is assigned with textContent."},{"gate":"data-integrity","status":"n/a","reason":"Explicitly static mock data and interactions, not detector/parser/calculation code or a validated fix implementation."},{"gate":"performance","status":"n/a","reason":"Superseded throwaway static prototype not wired into the application, so no production hot path or shipped surface is introduced."}]}],"findings":[]}