{"baseline":"c8b98a29508b5eb7725c75a7e2a41dfa94c1feba","auditDate":"2026-07-26","section":"src/lib (non-detectors)","gates":["security","data-integrity","performance"],"auditedFiles":["src/lib/parse-deceit-signals.test.ts","src/lib/parse-deceit-signals.ts","src/lib/parse-docs-map.test.ts","src/lib/parse-docs-map.ts","src/lib/parse-docs.test.ts"],"verdicts":[{"file":"src/lib/parse-deceit-signals.test.ts","gates":[{"gate":"security","status":"n/a","reason":"Test fixtures exercise pure transcript parsing and perform no authentication, egress, filesystem writes, browser rendering, command execution, or secret handling."},{"gate":"data-integrity","status":"clean","reason":"Inspected the expected counts and regression fixtures for backed, unbacked, contradicted, disclosed, and negated claims; assertions are deterministic, though they do not cover the implementation defect reported separately."},{"gate":"performance","status":"n/a","reason":"Test-only code is not a production hot path and introduces no shipped runtime surface."}]},{"file":"src/lib/parse-deceit-signals.ts","gates":[{"gate":"security","status":"n/a","reason":"Pure parser with no authentication, filesystem access, command execution, network/LLM egress, browser rendering, or secret handling."},{"gate":"data-integrity","status":"finding","reason":"A task-notification anywhere in the session is treated as evidence for every deferred action claim, even when unrelated and unaccompanied by a verification run."},{"gate":"performance","status":"clean","reason":"Inspected the two linear transcript passes, bounded five-item snippet output, and constant-size claim matching; no N× recomputation or unbounded emitted payload was found."}]},{"file":"src/lib/parse-docs-map.test.ts","gates":[{"gate":"security","status":"clean","reason":"Inspected traversal, absolute-path, control-character, invisible-character, prototype-key, malformed-remote, and strict-key rejection coverage; filesystem reads use validated repository fixtures only."},{"gate":"data-integrity","status":"clean","reason":"Tests reproducibly cover whole-map rejection, identity normalization, count bounds, duplicate rejection, and real source/symbol binding."},{"gate":"performance","status":"n/a","reason":"Test-only code is not a production hot path and introduces no shipped runtime surface."}]},{"file":"src/lib/parse-docs-map.ts","gates":[{"gate":"security","status":"clean","reason":"Inspected path and remote validation, traversal/absolute/drive/tilde rejection, control and invisible-character rejection, strict own-key validation, and null-prototype output construction."},{"gate":"data-integrity","status":"clean","reason":"The parser rejects malformed maps atomically, preserves explicit source/symbol bindings, rejects duplicates, and canonicalizes derived repository identity deterministically."},{"gate":"performance","status":"clean","reason":"Document, source, symbol, path, repository, and input-file limits bound parser work and output size; processing is linear within those caps."}]},{"file":"src/lib/parse-docs.test.ts","gates":[{"gate":"security","status":"clean","reason":"Inspected temporary filesystem writes/removal and mocked git invocation assertions; paths are rooted in freshly created temporary directories and no untrusted shell execution occurs."},{"gate":"data-integrity","status":"clean","reason":"Tests reproducibly cover graph edges, canonical issue references, frontmatter ownership, category derivation, deterministic output, and explicit git/manifest/filesystem timestamp provenance."},{"gate":"performance","status":"clean","reason":"The suite verifies one bounded git-history query with explicit max-count and maxBuffer limits, plus deterministic de-duplicated graph output."}]}],"findings":[{"lens":"data-integrity","severity":"medium","title":"Any task notification suppresses all unbacked-action signals","files":["src/lib/parse-deceit-signals.ts:174"],"where":"src/lib/parse-deceit-signals.ts:174 and src/lib/parse-deceit-signals.ts:188","what":"The parser sets taskNotificationSeen for any user content containing a task-notification tag, then initializes the session-wide hasVerificationEvidence flag from that boolean. Consequently, an unrelated notification such as a completed documentation task makes a later unsupported claim like “I ran the tests” appear backed, yielding unbackedClaimCount=0 without a matching verification command or result. This makes the emitted detector evidence non-reproducible from the claimed action.","fix":"Do not promote a bare session-wide notification to generic verification evidence. Require a resolved, relevant verification command/result, or parse and correlate notification identity/type to the specific action claim before treating it as backing evidence.","acceptance":"Add a regression fixture containing only an unrelated task-notification followed by “I ran the tests and they pass”; assert unbackedClaimCount is 1. Retain a fixture with a successful verification Bash tool_use/tool_result and assert the corresponding claim remains backed with count 0.","priority":"Medium","verified":true,"verifyNote":"Adversarial re-read confirmed lines 174-175 accept notification presence without inspecting its task, outcome, or relationship to a claim; line 188 makes that boolean global evidence, and lines 245-248 suppress every deferred action claim whenever it is true. The existing background-completion test at src/lib/parse-deceit-signals.test.ts:67 includes both a notification and a successful Bash result, so it does not disprove the notification-only false negative."}]}