{"baseline":"c8b98a29508b5eb7725c75a7e2a41dfa94c1feba","auditDate":"2026-07-26","section":"src/lib (non-detectors)","gates":["security","data-integrity","performance"],"auditedFiles":["src/lib/session-overview.test.ts","src/lib/session-overview.ts","src/lib/session-scorecard.test.ts","src/lib/session-scorecard.ts","src/lib/session-summaries.test.ts","src/lib/session-summaries.ts","src/lib/session-type-classifier.test.ts","src/lib/session-type-classifier.ts","src/lib/settings-validation.test.ts","src/lib/shadow-experiments-client.spa.ts","src/lib/shadow-experiments-client.ts","src/lib/shadow-experiments.test.ts"],"verdicts":[{"file":"src/lib/session-overview.test.ts","gates":[{"gate":"security","status":"n/a","reason":"Pure calculation test with no security boundary or side effect."},{"gate":"data-integrity","status":"clean","reason":"Checked the stripped-summary user-turn fixture and asserted derived-count behavior."},{"gate":"performance","status":"n/a","reason":"Small unit test, not production hot-path code."}]},{"file":"src/lib/session-overview.ts","gates":[{"gate":"security","status":"clean","reason":"Consumes parsed data only; file paths are counted as inert strings and no command, filesystem, network, or HTML sink exists."},{"gate":"data-integrity","status":"clean","reason":"Re-derived token totals, peak context, duration, error totals, tool/file counts, and user-turn logic; calculations match their source fields."},{"gate":"performance","status":"clean","reason":"Uses bounded linear passes and top-five sorting over aggregated maps without per-entry network or filesystem work."}]},{"file":"src/lib/session-scorecard.test.ts","gates":[{"gate":"security","status":"clean","reason":"Dangerous-command and stripped-command fixtures remain inert and exercise safety scoring without execution or egress."},{"gate":"data-integrity","status":"clean","reason":"Covers score ordering, confidence floors, recovery signals, cache curves, and partial-data behavior with reproducible fixtures."},{"gate":"performance","status":"n/a","reason":"Unit tests do not ship on the production hot path."}]},{"file":"src/lib/session-scorecard.ts","gates":[{"gate":"security","status":"clean","reason":"Security scoring inspects parsed permission and command signals only; it performs no command execution, authorization decision, filesystem write, or egress."},{"gate":"data-integrity","status":"clean","reason":"Re-derived score clamps, confidence adjustment, cost, duration, error-rate, cache, and context formulas; emitted evidence names the contributing observed signals."},{"gate":"performance","status":"clean","reason":"Scoring uses bounded linear passes over supplied session arrays and no heavyweight dependency or external I/O."}]},{"file":"src/lib/session-summaries.test.ts","gates":[{"gate":"security","status":"n/a","reason":"Pure calculation fixtures contain paths as inert data and exercise no security boundary."},{"gate":"data-integrity","status":"clean","reason":"Tests reproducibly cover totals, inclusive time edges, costs, project aggregation, deterministic ordering, and sparse data."},{"gate":"performance","status":"clean","reason":"The tests cover functional scale boundaries, and contain no production computation themselves."}]},{"file":"src/lib/session-summaries.ts","gates":[{"gate":"security","status":"clean","reason":"Uses already-parsed local records and performs no LLM/network egress, filesystem access, command execution, or HTML injection."},{"gate":"data-integrity","status":"clean","reason":"Session and window claims derive deterministically from identified session, token, tool, project, and time fields; totals and inclusive window arithmetic were re-derived."},{"gate":"performance","status":"finding","reason":"Each nested rollup window rescans sessions and recomputes per-session summaries and tool aggregation, repeating work for sessions present in multiple windows."}]},{"file":"src/lib/session-type-classifier.test.ts","gates":[{"gate":"security","status":"n/a","reason":"Pure heuristic unit tests with no security-sensitive operation."},{"gate":"data-integrity","status":"clean","reason":"Fixtures cover every classification branch, synthetic-marker exclusion, and lookup behavior deterministically."},{"gate":"performance","status":"n/a","reason":"Small unit test, not shipped hot-path code."}]},{"file":"src/lib/session-type-classifier.ts","gates":[{"gate":"security","status":"clean","reason":"Classifies local strings with fixed regular expressions and performs no egress, execution, filesystem operation, or rendering."},{"gate":"data-integrity","status":"clean","reason":"Classification is explicitly labeled best-effort and deterministically derives from prompt count, duration, and matched verb signals."},{"gate":"performance","status":"clean","reason":"Single linear prompt pass with fixed regular expressions and a linear lookup-map build."}]},{"file":"src/lib/settings-validation.test.ts","gates":[{"gate":"security","status":"clean","reason":"Security-sensitive settings fixtures are inert; tests explicitly verify environment values are not echoed and only variable names are reported."},{"gate":"data-integrity","status":"clean","reason":"Covers syntax, types, rule paths, missing environment references, cycles, and absence semantics with exact assertions."},{"gate":"performance","status":"n/a","reason":"Unit test only, with small fixed fixtures."}]},{"file":"src/lib/shadow-experiments-client.spa.ts","gates":[{"gate":"security","status":"clean","reason":"SPA seam contains no fetch, server URL, credential handling, or executable rendering sink."},{"gate":"data-integrity","status":"clean","reason":"Returns a complete internally consistent zero-result response rather than fabricating experiment data."},{"gate":"performance","status":"clean","reason":"Constant-size stub with type-only imports and no network or heavy runtime dependency."}]},{"file":"src/lib/shadow-experiments-client.ts","gates":[{"gate":"security","status":"clean","reason":"Uses the central serverFetch boundary; numeric options are URL-encoded and no credential, HTML, command, or filesystem sink is introduced."},{"gate":"data-integrity","status":"clean","reason":"Preserves the documented paginated response fields and returns a consistent empty response on transport or HTTP failure."},{"gate":"performance","status":"clean","reason":"Lazy-seam client performs one bounded request and adds no eager bundle-heavy dependency."}]},{"file":"src/lib/shadow-experiments.test.ts","gates":[{"gate":"security","status":"n/a","reason":"Parser fixtures are inert strings and invoke no privileged, network, filesystem, or rendering operation."},{"gate":"data-integrity","status":"clean","reason":"Tests reconciliation, malformed rows, timestamps, deltas, provenance fields, bounded row retention, and trend-window arithmetic."},{"gate":"performance","status":"clean","reason":"Explicitly tests maxRows and maxDays bounds that prevent unbounded retained rows and ancient-date bucket expansion."}]}],"findings":[{"lens":"performance","severity":"low","title":"Nested activity windows repeatedly recompute the same session summaries","files":["src/lib/session-summaries.ts:282"],"where":"src/lib/session-summaries.ts:282","what":"ROLLUP_WINDOWS.map filters the full ordered session list for each of four nested windows, then lines 296-324 recompute composeSessionSummary and rescan every matching session's tool calls. A session in the last hour is therefore summarized and tool-aggregated four times per rollup request. The subsequent per-window sorts repeat over the same nested population as well.","fix":"Precompute each session's summary and tool contribution once, then accumulate those prepared rows into the applicable windows in one pass; retain per-window maps and bounded notable-session selection.","acceptance":"Add an instrumented test with sessions shared by all four windows and assert compose/aggregation work occurs once per session while every existing rollup result remains deeply equal; a benchmark or probe should show linear session/tool traversal rather than four repeated traversals.","priority":"Low","verified":true,"verifyNote":"Adversarial second pass re-read src/lib/session-summaries.ts:265-360 and the overlapping-window tests at src/lib/session-summaries.test.ts:180-273. The windows are nested, and no memoization or precomputed summary exists before the per-window map, so repeated filtering, summary composition, tool scanning, and sorting are present in the audited baseline."}]}