{"baseline":"c8b98a29508b5eb7725c75a7e2a41dfa94c1feba","auditDate":"2026-07-26","section":"docs/","gates":["security","data-integrity","performance"],"auditedFiles":["docs/memory-lifecycle-schema.md","docs/mobile-parity-audit.md","docs/mobile-testing-rigor-spike.md","docs/mobile-visual-regression-pilot.md","docs/multi-user-recommendations.md"],"verdicts":[{"file":"docs/memory-lifecycle-schema.md","gates":[{"gate":"security","status":"clean","reason":"Inspected the executable contract's path containment, traversal rejection, symlink handling, network opt-in, cache authorization, secret-minimizing evidence, and fail-closed error behavior; no current defect found."},{"gate":"data-integrity","status":"clean","reason":"Re-derived clause precedence, date/interval examples, TTL boundaries, cache validity, deterministic inventory limits, and required provenance; claims are reproducible and internally consistent."},{"gate":"performance","status":"clean","reason":"The contract supplies explicit entry, file-count, per-file-byte, aggregate-byte, and inspection ceilings plus streaming enumeration and exact cap/probe acceptance tests."}]},{"file":"docs/mobile-parity-audit.md","gates":[{"gate":"security","status":"n/a","reason":"Narrative mobile-layout audit; it does not define authentication, filesystem, egress, injection, RBAC, container, TLS, or secret-handling behavior."},{"gate":"data-integrity","status":"n/a","reason":"Narrative UI audit, not executable configuration and not a detector, parser, or calculation contract."},{"gate":"performance","status":"n/a","reason":"The document records viewport layout checks and does not define hot-path code or ship a runtime surface."}]},{"file":"docs/mobile-testing-rigor-spike.md","gates":[{"gate":"security","status":"n/a","reason":"Testing-tool recommendation with no security-sensitive runtime behavior or executable configuration."},{"gate":"data-integrity","status":"n/a","reason":"Narrative testing spike, not a detector, parser, or calculation contract."},{"gate":"performance","status":"n/a","reason":"Discusses CI test duration rather than application hot-path performance or a newly shipped runtime surface."}]},{"file":"docs/mobile-visual-regression-pilot.md","gates":[{"gate":"security","status":"n/a","reason":"Manual visual-testing instructions do not participate in the active security concerns."},{"gate":"data-integrity","status":"n/a","reason":"Narrative pilot report, not executable configuration and not a detector, parser, or calculation contract."},{"gate":"performance","status":"n/a","reason":"Screenshot-test maintenance and runner stability are not application hot-path performance concerns."}]},{"file":"docs/multi-user-recommendations.md","gates":[{"gate":"security","status":"clean","reason":"Checked GitHub-token handling, scoped-ingest isolation, identity resolution, and transcript/prompt minimization; the contract avoids raw-token persistence, restricts org-wide data to admin/global scope, and forbids inferred identity from private content."},{"gate":"data-integrity","status":"clean","reason":"Detector claims specify structured source fields, explicit thresholds, alias rules, null/ambiguous behavior, and concrete task or review-event provenance sufficient for reproducibility."},{"gate":"performance","status":"clean","reason":"The server-side review source is described as bounded, cached, and incorporated into source signatures/content hashes; no unbounded per-request recomputation or unsupported new-surface performance claim is defined here."}]}],"findings":[]}